{
  "url": "https://api.github.com/repos/borisyankov/DefinitelyTyped/contents/jquery/jquery.d.ts?ref=master",
  "key": "9475d358a03312943fd546c6b7ce2f74748514d0",
  "contentType": "video/mp2t",
  "cacheCreated": "2014-06-21T03:12:54.355Z",
  "cacheUpdated": "2014-06-21T04:11:57.073Z",
  "httpETag": "\"6b4ebb68ae3a62d4ce4b57b9745fa3ea900067a5\"",
  "httpModified": "2014-06-21T04:11:57.073Z",
  "contentChecksum": "b4f13e5009bbd4185c2f01c29113a39f806aff6f"
}
