{
  "url": "https://api.github.com/repos/borisyankov/DefinitelyTyped/contents/async/async.d.ts?ref=master",
  "key": "bd6bd1beef3497d75dcfdb27dfb5c041b045c50c",
  "contentType": "video/mp2t",
  "cacheCreated": "2014-06-21T03:12:50.808Z",
  "cacheUpdated": "2014-06-21T04:11:53.749Z",
  "httpETag": "\"25736941fe8de2b32cd354004c3737892b74acf4\"",
  "httpModified": "2014-06-21T04:11:53.749Z",
  "contentChecksum": "190840176d4765445169bf62a81163c97696819c"
}
