{
  "url": "https://api.github.com/repos/DefinitelyTyped/DefinitelyTyped/commits?path=async%2Fasync.d.ts",
  "key": "2317caa92ea3c2a2c942f69c4fb8ebb40237974c",
  "contentType": "application/json; charset=utf-8",
  "cacheCreated": "2014-06-21T03:12:49.761Z",
  "cacheUpdated": "2014-06-21T04:08:52.314Z",
  "httpETag": "\"f0d1665bf3010b02ff11095a8a83fa23\"",
  "httpModified": "2014-06-07T09:57:20.000Z",
  "contentChecksum": "f6643d830e70d24d7e27063b6d96417092269db7"
}