{
  "url": "https://api.github.com/repos/borisyankov/DefinitelyTyped/contents/chai/chai.d.ts?ref=master",
  "key": "f74eeece0a10c145464cec52f43e9ea3d72e75c5",
  "contentType": "video/mp2t",
  "cacheCreated": "2014-06-21T03:12:55.458Z",
  "cacheUpdated": "2014-06-21T04:11:58.057Z",
  "httpETag": "\"54d5770c97350ea0c2bab2b4a59ec64fbd200912\"",
  "httpModified": "2014-06-21T04:11:58.057Z",
  "contentChecksum": "a3c937d168f51e91b24061a09ab952ac7055c703"
}
