{
  "url": "https://api.github.com/repos/DefinitelyTyped/DefinitelyTyped/git/trees/69e3f7383790601cd1fb7d6c674a127e43b23dce?recursive=1",
  "key": "0562698464ba60434bb2b01f3b2dda4f25519758",
  "contentType": "application/json; charset=utf-8",
  "cacheCreated": "2014-06-21T03:12:49.070Z",
  "cacheUpdated": "2014-06-21T03:36:49.444Z",
  "httpETag": "\"a0bc16464c0348166514b9db918b0506\"",
  "httpModified": "2014-06-20T13:14:41.000Z",
  "contentChecksum": "a0759b8106a41810fd2e27abfa3ff5cb70ca929b"
}