{
  "url": "https://raw.githubusercontent.com/DefinitelyTyped/DefinitelyTyped/master/async/async.d.ts",
  "key": "2271dafd800fb0437db21c63217a3ba8407b7c55",
  "contentType": "video/mp2t",
  "cacheCreated": "2014-06-21T03:12:50.808Z",
  "cacheUpdated": "2014-06-21T04:11:53.749Z",
  "httpETag": "\"25736941fe8de2b32cd354004c3737892b74acf4\"",
  "httpModified": "2014-06-21T04:11:53.749Z",
  "contentChecksum": "190840176d4765445169bf62a81163c97696819c"
}
