{
  "url": "https://raw.githubusercontent.com/DefinitelyTyped/DefinitelyTyped/master/chai/chai.d.ts",
  "key": "3ade19e775aa771afa43579727d13495e1502a0a",
  "contentType": "video/mp2t",
  "cacheCreated": "2014-06-21T03:12:55.458Z",
  "cacheUpdated": "2014-06-21T04:11:58.057Z",
  "httpETag": "\"54d5770c97350ea0c2bab2b4a59ec64fbd200912\"",
  "httpModified": "2014-06-21T04:11:58.057Z",
  "contentChecksum": "a3c937d168f51e91b24061a09ab952ac7055c703"
}
