{
  "url": "https://api.github.com/repos/DefinitelyTyped/DefinitelyTyped/git/trees/22033b203eaaaf7427f961d661407104268d1d81?recursive=1",
  "key": "6b90f59783451b80ac9b2aff9378cd79478dc0a7",
  "contentType": "application/json; charset=utf-8",
  "cacheCreated": "2014-06-21T04:08:51.565Z",
  "cacheUpdated": "2014-06-21T04:08:51.565Z",
  "httpETag": "\"fb53131c68724a886ad9f0aa2205dbe6\"",
  "httpModified": "2014-06-21T03:49:46.000Z",
  "contentChecksum": "2e087ec6b1a4d815ade563087a05706d85a10dd9"
}