{
  "url": "https://raw.githubusercontent.com/DefinitelyTyped/DefinitelyTyped/master/jquery/jquery.d.ts",
  "key": "9aedb9357f0e835ea1df6092ed4fedd5e793b126",
  "contentType": "video/mp2t",
  "cacheCreated": "2014-06-21T03:12:54.355Z",
  "cacheUpdated": "2014-06-21T04:11:57.073Z",
  "httpETag": "\"6b4ebb68ae3a62d4ce4b57b9745fa3ea900067a5\"",
  "httpModified": "2014-06-21T04:11:57.073Z",
  "contentChecksum": "b4f13e5009bbd4185c2f01c29113a39f806aff6f"
}
