{
  "url": "https://api.github.com/repos/borisyankov/DefinitelyTyped/contents/bootstrap/bootstrap.d.ts?ref=master",
  "key": "c038a3295cd6fc9104b0acdfe260e5f28f4e7613",
  "contentType": "video/mp2t",
  "cacheCreated": "2014-06-21T03:12:52.361Z",
  "cacheUpdated": "2014-06-21T04:11:55.329Z",
  "httpETag": "\"b9fe9cd59728baa3934a454c7bd979a46270b0bd\"",
  "httpModified": "2014-06-21T04:11:55.329Z",
  "contentChecksum": "c5aa93d7bd12a5e6aabe98ade2ff2262e9e40f44"
}
