{
  "url": "https://raw.githubusercontent.com/DefinitelyTyped/DefinitelyTyped/master/bootstrap/bootstrap.d.ts",
  "key": "1166d8058295930735943069d75369fd520c8a76",
  "contentType": "video/mp2t",
  "cacheCreated": "2014-06-21T03:12:52.361Z",
  "cacheUpdated": "2014-06-21T04:11:55.329Z",
  "httpETag": "\"b9fe9cd59728baa3934a454c7bd979a46270b0bd\"",
  "httpModified": "2014-06-21T04:11:55.329Z",
  "contentChecksum": "c5aa93d7bd12a5e6aabe98ade2ff2262e9e40f44"
}
